{
  "schema": "avengine_m6_entity_asset_registry_v1",
  "registry_id": "m6_entity_assets_canary_v1",
  "revision": "v1",
  "entities": [
    {
      "entity_asset_id": "legacy_apartment_source_marker_front_v1",
      "revision": "m1_package_v1",
      "entity_class": "rigid_object",
      "visual_asset": {
        "uri": "artifact://m1/legacy_apartment_package/visual/objects/source_marker_0.glb",
        "sha256": "a5cea9d5cd067afc1ccbd28bc0740256786cd53425e26a4ff707d2da76b8336c"
      },
      "realized_visual_attributes": {
        "object_type": "directional_source_marker",
        "color": "red"
      },
      "capabilities": {
        "articulated": false,
        "skeleton_revision": null,
        "skeleton_sha256": null,
        "action_ids": []
      },
      "emitter_anchors": [
        {"anchor_id": "speaker", "anchor_type": "object_speaker", "joint_id": null, "local_position_m": [0.0, 0.0, 0.0]}
      ],
      "provenance": {
        "source": "SPEAR apartment_0000 Habitat package source marker",
        "source_revision": "m1_package_v1",
        "license": null,
        "rights_status": "research_use_only",
        "evidence_sha256": "a5cea9d5cd067afc1ccbd28bc0740256786cd53425e26a4ff707d2da76b8336c"
      },
      "admission_state": "research"
    },
    {
      "entity_asset_id": "legacy_apartment_source_marker_rear_v1",
      "revision": "m1_package_v1",
      "entity_class": "rigid_object",
      "visual_asset": {
        "uri": "artifact://m1/legacy_apartment_package/visual/objects/source_marker_1.glb",
        "sha256": "93d74624050d905594315defefaec4465b0794650beb5f842f1b6c9b0e7b38e7"
      },
      "realized_visual_attributes": {
        "object_type": "directional_source_marker",
        "color": "blue"
      },
      "capabilities": {
        "articulated": false,
        "skeleton_revision": null,
        "skeleton_sha256": null,
        "action_ids": []
      },
      "emitter_anchors": [
        {"anchor_id": "speaker", "anchor_type": "object_speaker", "joint_id": null, "local_position_m": [0.0, 0.0, 0.0]}
      ],
      "provenance": {
        "source": "SPEAR apartment_0000 Habitat package source marker",
        "source_revision": "m1_package_v1",
        "license": null,
        "rights_status": "research_use_only",
        "evidence_sha256": "93d74624050d905594315defefaec4465b0794650beb5f842f1b6c9b0e7b38e7"
      },
      "admission_state": "research"
    },
    {
      "entity_asset_id": "rocketbox_dog_beagle_01_m2_v7_world_contact_candidate",
      "revision": "m2_v7_world_contact_r5",
      "entity_class": "articulated_animal",
      "visual_asset": {
        "uri": "artifact://m2/rocketbox_beagle_m2_canary_v7_world_contact_r5/visual.glb",
        "sha256": "788a667537f7660bac5e128c38c2182453d1d4a9a4f8380343e7a9fa1947538c"
      },
      "animal_template_ref": {
        "template_id": "rocketbox_dog_beagle_01",
        "revision": "m2_v7_world_contact_r5"
      },
      "realized_visual_attributes": {
        "species_id": "dog",
        "breed_id": "beagle",
        "size": "medium",
        "body_build": "standard",
        "life_stage": "adult",
        "coat_profile": {
          "profile_id": "dog_beagle_tricolor_v1",
          "value": "standard_tricolor"
        }
      },
      "capabilities": {
        "articulated": true,
        "skeleton_revision": "rocketbox-beagle-skeleton-m2-v4-world-left",
        "skeleton_sha256": "711ce9669235a7d0547bd9b88dbf4c0d056149d96bcd0f451598943dbcd32841",
        "action_ids": ["idle", "walk"]
      },
      "emitter_anchors": [
        {"anchor_id": "body", "anchor_type": "body", "joint_id": "beagle Pelvis", "local_position_m": [0.0, 0.0, 0.0]},
        {"anchor_id": "head", "anchor_type": "head", "joint_id": "beagle Head", "local_position_m": [0.0, 0.0, 0.0]},
        {"anchor_id": "muzzle", "anchor_type": "muzzle", "joint_id": "beagle Xtra Mouth", "local_position_m": [0.0, 0.0, 0.0]},
        {"anchor_id": "paw_front_left", "anchor_type": "paw", "joint_id": "beagle L Finger0", "local_position_m": [0.0, 0.0, 0.0]},
        {"anchor_id": "paw_front_right", "anchor_type": "paw", "joint_id": "beagle R Finger0", "local_position_m": [0.0, 0.0, 0.0]},
        {"anchor_id": "paw_hind_left", "anchor_type": "paw", "joint_id": "beagle L Toe0", "local_position_m": [0.0, 0.0, 0.0]},
        {"anchor_id": "paw_hind_right", "anchor_type": "paw", "joint_id": "beagle R Toe0", "local_position_m": [0.0, 0.0, 0.0]}
      ],
      "provenance": {
        "source": "Microsoft Rocketbox Dog_Beagle_01 plus reviewed AVEngine realization",
        "source_revision": "0943055db6ec570bcef9f2c8b41c9e5467c808f9",
        "license": "MIT",
        "rights_status": "research_use_only",
        "evidence_sha256": "ad5df61f4b955980f6ab3d6d00e44f31942cb31ce3d2f2a3c1a1f353c307e240"
      },
      "admission_state": "research"
    },
    {
      "entity_asset_id": "rocketbox_human_male_adult_01_m5_1_candidate",
      "revision": "native_runtime_ue_v3",
      "entity_class": "articulated_human",
      "visual_asset": {
        "uri": "artifact://legacy-spear/rocketbox_native_runtime_ue_v3/rocketbox_male_adult_01_original_ue_v3/runtime.glb",
        "sha256": "02c13940227bd724d03aa91861e6acefde5457f0d2df9f808d427e88a3e94059"
      },
      "realized_visual_attributes": {
        "age_group": "adult",
        "base_avatar_id": "rocketbox_adults_male_adult_01_original_ue_v1",
        "sex_or_gender_label": "male"
      },
      "capabilities": {
        "articulated": true,
        "skeleton_revision": "rocketbox_human_bip01_native_v3",
        "skeleton_sha256": null,
        "action_ids": ["idle", "walk"]
      },
      "emitter_anchors": [
        {"anchor_id": "body", "anchor_type": "body", "joint_id": "Bip01 Pelvis", "local_position_m": [0.0, 0.0, 0.0]},
        {"anchor_id": "head", "anchor_type": "head", "joint_id": "Bip01 Head", "local_position_m": [0.0, 0.0, 0.0]},
        {"anchor_id": "mouth", "anchor_type": "mouth", "joint_id": "Bip01 MJaw", "local_position_m": [0.0, 0.0, 0.0]}
      ],
      "provenance": {
        "source": "Microsoft Rocketbox male adult 01 plus AVEngine Habitat runtime preparation",
        "source_revision": "native_runtime_ue_v3",
        "license": "MIT",
        "rights_status": "research_use_only",
        "evidence_sha256": "7975afb2a02d97f5c6ab48528ba68e5d0c379f892194b8d0aa489adc54539f15"
      },
      "admission_state": "research"
    }
  ],
  "registry_content_sha256": "80254a6c973d055aafbc44b52aa5f1c22a049107fd6b6d43f2432b8bb8b75016"
}
